{"$schema":"https://json-schema.org/draft/2020-12/schema","$id":"https://gmatquestionstimer.vercel.app/schemas/gmat-quiz.schema.json","title":"GMAT Quiz Import","type":"object","additionalProperties":false,"required":["schemaVersion","metadata","assets","passages","stimuli","questions"],"properties":{"schemaVersion":{"const":"gmat-quiz@1"},"metadata":{"$ref":"#/$defs/metadata"},"assets":{"type":"array","maxItems":25,"items":{"$ref":"#/$defs/asset"}},"passages":{"type":"array","maxItems":100,"items":{"$ref":"#/$defs/passage"}},"stimuli":{"type":"array","maxItems":100,"items":{"$ref":"#/$defs/stimulus"}},"questions":{"type":"array","minItems":1,"maxItems":500,"items":{"$ref":"#/$defs/question"}}},"$defs":{"shortText":{"type":"string","maxLength":5000},"longText":{"type":"string","maxLength":50000},"nullableShortText":{"type":["string","null"],"maxLength":5000},"id":{"type":"string","pattern":"^[A-Za-z0-9][A-Za-z0-9._:-]{0,99}$"},"sourceRef":{"type":"object","additionalProperties":false,"required":["pdfPage","label"],"properties":{"pdfPage":{"type":["integer","null"],"minimum":1},"label":{"type":"string","maxLength":300}}},"metadata":{"type":"object","additionalProperties":false,"required":["title","description","sourceLabel","createdBy","language","sectionHint","copyrightNotice"],"properties":{"title":{"type":"string","minLength":1,"maxLength":300},"description":{"type":"string","maxLength":2000},"sourceLabel":{"type":"string","maxLength":500},"createdBy":{"type":"string","maxLength":300},"language":{"type":"string","minLength":2,"maxLength":20},"sectionHint":{"enum":["QUANT","VERBAL","DI","MIXED"]},"copyrightNotice":{"type":"string","maxLength":1000}}},"asset":{"type":"object","additionalProperties":false,"required":["id","mimeType","dataUrl","altText"],"properties":{"id":{"$ref":"#/$defs/id"},"mimeType":{"enum":["image/png","image/jpeg","image/webp"]},"dataUrl":{"type":"string","pattern":"^data:image/(png|jpeg|webp);base64,"},"altText":{"type":"string","minLength":1,"maxLength":2000}}},"passage":{"type":"object","additionalProperties":false,"required":["id","title","text","sourceRef"],"properties":{"id":{"$ref":"#/$defs/id"},"title":{"$ref":"#/$defs/nullableShortText"},"text":{"type":"string","minLength":1,"maxLength":50000},"sourceRef":{"$ref":"#/$defs/sourceRef"}}},"table":{"type":"object","additionalProperties":false,"required":["columns","rows"],"properties":{"columns":{"type":"array","minItems":1,"maxItems":50,"items":{"type":"string","maxLength":500}},"rows":{"type":"array","maxItems":1000,"items":{"type":"array","maxItems":50,"items":{"type":"string","maxLength":5000}}}}},"stimulusSource":{"type":"object","additionalProperties":false,"required":["id","label","format"],"properties":{"id":{"$ref":"#/$defs/id"},"label":{"type":"string","minLength":1,"maxLength":500},"format":{"enum":["text","table","asset"]},"text":{"$ref":"#/$defs/longText"},"table":{"$ref":"#/$defs/table"},"assetId":{"$ref":"#/$defs/id"}}},"stimulus":{"type":"object","additionalProperties":false,"required":["id","title","kind","sources","visualDescription","sourceRef"],"properties":{"id":{"$ref":"#/$defs/id"},"title":{"$ref":"#/$defs/nullableShortText"},"kind":{"enum":["single_source","multi_source","table","graphic","mixed"]},"sources":{"type":"array","minItems":1,"maxItems":20,"items":{"$ref":"#/$defs/stimulusSource"}},"visualDescription":{"type":["string","null"],"maxLength":10000},"sourceRef":{"$ref":"#/$defs/sourceRef"}}},"option":{"type":"object","additionalProperties":false,"required":["id","text"],"properties":{"id":{"$ref":"#/$defs/id"},"text":{"type":"string","minLength":1,"maxLength":10000}}},"statement":{"type":"object","additionalProperties":false,"required":["id","text"],"properties":{"id":{"$ref":"#/$defs/id"},"text":{"type":"string","minLength":1,"maxLength":10000}}},"task":{"type":"object","additionalProperties":false,"required":["id","label","prompt"],"properties":{"id":{"$ref":"#/$defs/id"},"label":{"type":"string","minLength":1,"maxLength":500},"prompt":{"type":"string","minLength":1,"maxLength":10000}}},"blank":{"type":"object","additionalProperties":false,"required":["id","label","options"],"properties":{"id":{"$ref":"#/$defs/id"},"label":{"type":"string","minLength":1,"maxLength":500},"options":{"type":"array","minItems":2,"maxItems":20,"items":{"$ref":"#/$defs/option"}}}},"correctAnswer":{"type":["object","null"],"additionalProperties":false,"properties":{"optionIds":{"type":"array","minItems":1,"maxItems":12,"uniqueItems":true,"items":{"$ref":"#/$defs/id"}},"statementChoices":{"type":"object","additionalProperties":{"$ref":"#/$defs/id"}},"taskChoices":{"type":"object","additionalProperties":{"type":"array","minItems":1,"uniqueItems":true,"items":{"$ref":"#/$defs/id"}}},"blankChoices":{"type":"object","additionalProperties":{"$ref":"#/$defs/id"}}}},"explanation":{"type":"object","additionalProperties":false,"required":["summary","optionExplanations"],"properties":{"summary":{"type":"string","maxLength":50000},"optionExplanations":{"type":"object","additionalProperties":{"type":"string","maxLength":10000}}}},"question":{"type":"object","additionalProperties":false,"required":["id","section","type","responseType","passageId","stimulusId","stem","instruction","options","statements","tasks","blanks","correctAnswer","explanation","difficulty","tags","status","answerOrigin","confidence","reviewNotes","sourceRef"],"properties":{"id":{"$ref":"#/$defs/id"},"section":{"enum":["QUANT","VERBAL","DI"]},"type":{"enum":["PS","CR","RC","DS","MSR","TA","GI","TPA","SC_LEGACY","QC_LEGACY"]},"responseType":{"enum":["single_choice","multi_select","statement_matrix","two_part","dropdown_blanks"]},"passageId":{"type":["string","null"],"maxLength":100},"stimulusId":{"type":["string","null"],"maxLength":100},"stem":{"type":"string","minLength":1,"maxLength":50000},"instruction":{"type":["string","null"],"maxLength":5000},"options":{"type":"array","maxItems":20,"items":{"$ref":"#/$defs/option"}},"statements":{"type":"array","maxItems":50,"items":{"$ref":"#/$defs/statement"}},"tasks":{"type":"array","maxItems":10,"items":{"$ref":"#/$defs/task"}},"blanks":{"type":"array","maxItems":20,"items":{"$ref":"#/$defs/blank"}},"correctAnswer":{"$ref":"#/$defs/correctAnswer"},"explanation":{"$ref":"#/$defs/explanation"},"difficulty":{"enum":["easy","medium","hard","unknown"]},"tags":{"type":"array","maxItems":30,"uniqueItems":true,"items":{"type":"string","maxLength":100}},"status":{"enum":["ready","needs_review"]},"answerOrigin":{"enum":["explicit_in_pdf","model_inferred","unknown"]},"confidence":{"type":"number","minimum":0,"maximum":1},"reviewNotes":{"type":["string","null"],"maxLength":5000},"sourceRef":{"$ref":"#/$defs/sourceRef"}}}}}